capability_code,capability_label,default_stages,rank,node_name,provider_type,description,ranking_rationale,key_sources
C-SOCIAL-INSPIRATION,Social Inspiration,"J0,J8",1,Instagram,SOCIAL_PLATFORM,Visual-first social platform driving travel inspiration via Reels and Stories,"Dominant travel inspiration platform; billions of monthly users; consistently cited as #1 travel inspiration source across expert reviews",Business Traveller 2025; Saily 2026; TravelPirates 2025
C-SOCIAL-INSPIRATION,Social Inspiration,"J0,J8",2,TikTok,SOCIAL_PLATFORM,Short-form video platform with massive travel content creator ecosystem,"Fastest-growing travel inspiration channel; strong with Gen Z/millennial travelers; Dream Trip app integrates directly",Dream Trip 2026; Saily 2026; TravelPirates 2025
C-SOCIAL-INSPIRATION,Social Inspiration,"J0,J8",3,Pinterest,SOCIAL_PLATFORM,Visual discovery and bookmarking platform for trip mood boards and destination ideas,"Strong for aspirational/planning-phase inspiration; unique pin-board model for trip curation",Saily 2026; multiple travel blog roundups 2025
C-SOCIAL-INSPIRATION,Social Inspiration,"J0,J8",4,Reddit,FORUM,Community-driven travel discussions across thousands of subreddits (r/travel; r/solotravel; r/churning),"Highly trusted peer advice; Rick Steves forum community; strong for authentic traveler perspectives",Rick Steves Forum; Reddit travel communities; Slant 2025
C-CONTENT-PUBLISHING,Content Publishing,"J0,J1",1,Lonely Planet,CONTENT_PLATFORM,Premier travel guidebook publisher with digital destination guides and expert editorial content,"Decades of authority; most-cited expert travel content brand; strong digital + print presence",Schengen Travel Info 2025; multiple expert roundups
C-CONTENT-PUBLISHING,Content Publishing,"J0,J1",2,Culture Trip,CONTENT_PLATFORM,Editorial travel content platform with offbeat tour and experience bookings,"Strong editorial voice; unique focus on culture/local experiences; integrated booking",OHAYU eSIM 2026; Saily 2026
C-CONTENT-PUBLISHING,Content Publishing,"J0,J1",3,Time Out,CONTENT_PLATFORM,City-based editorial guides covering events; restaurants; and activities worldwide,"Expert-curated local content; strong urban focus; trusted for dining/nightlife recommendations",Trend Watchers 2024; multiple city guide roundups
C-ENCYCLOPEDIA-KNOWLEDGE,Encyclopedia Knowledge,J1,1,Wikipedia / Wikivoyage,ENCYCLOPEDIA,Open-source encyclopedia and its travel-focused sister project,"Universal reference; Wikivoyage praised for ad-free; unbiased travel information",Slant 2025; Wikitravel community
C-ENCYCLOPEDIA-KNOWLEDGE,Encyclopedia Knowledge,J1,2,Google Search / Knowledge Graph,SUPER_APP,Integrated knowledge panels and destination info surfaced in search results,"Default starting point for 70%+ of travel research; Knowledge Graph provides instant answers",SmarterTravel 2026; Going.com guides
C-REVIEW-RATINGS,Review & Ratings,"J1,J7",1,TripAdvisor,REVIEW_PLATFORM,Largest travel review platform with 1B+ reviews covering hotels; restaurants; and attractions,"Market leader by volume; 1B+ reviews; most-recognized travel review brand globally",Similarweb 2024; Latterly 2025; Semrush 2026
C-REVIEW-RATINGS,Review & Ratings,"J1,J7",2,Google Maps Reviews,SUPER_APP,Integrated review system within Google Maps covering all business types globally,"Ubiquitous; integrated with navigation; increasingly the first place travelers check reviews",SmarterTravel 2026; multiple expert roundups
C-REVIEW-RATINGS,Review & Ratings,"J1,J7",3,Yelp,REVIEW_PLATFORM,Restaurant and local business review platform dominant in North America,"Category leader for dining; 112M monthly visits; strong photo/review community",Semrush 2026; Latterly 2025
C-REVIEW-RATINGS,Review & Ratings,"J1,J7",4,Booking.com Reviews,OTA,Verified guest reviews (post-stay only) integrated with booking platform,"Verified-stay-only policy builds trust; 28M+ listings with reviews; Frommers ranks highly for filtering",Frommers 2026; SiteMinder 2025; Latterly 2025
C-FORUM-COMMUNITY,Forum / Community Q&A,"J0,J1,J7",1,Reddit (r/travel; r/solotravel),FORUM,Massive travel community with authentic peer advice across specialized subreddits,"Largest travel discussion community; authentic unfiltered advice; strong for niche topics",Multiple expert roundups; Rick Steves Forum references
C-FORUM-COMMUNITY,Forum / Community Q&A,"J0,J1,J7",2,FlyerTalk,FORUM,Premium travel and frequent flyer community focused on loyalty programs and premium travel,"Gold standard for points/miles/status discussions; highly engaged expert community",Upgraded Points 2025
C-FORUM-COMMUNITY,Forum / Community Q&A,"J0,J1,J7",3,Rick Steves Travel Forum,FORUM,European travel discussion community with practical planning advice,"Trusted for European travel; active engaged community; practical trip-planning focus",Rick Steves community posts 2025
C-FLIGHT-SEARCH,Flight Search,"J1,J3",1,Google Flights,METASEARCH,Fast metasearch with price tracking; flexible dates; and explore map,"Recommended starting point by Going.com and multiple experts; best date grid; price tracking labels",Going.com 2026; Upgraded Points 2025; Aviation A2Z 2025
C-FLIGHT-SEARCH,Flight Search,"J1,J3",2,Skyscanner,METASEARCH,Global metasearch with 1200+ airline sources and Everywhere search feature,"Widest airline coverage; best for budget/international; lowest fare on 50%+ of tested routes",Going.com 2026; Moonsand comparison; Nuroum 2025
C-FLIGHT-SEARCH,Flight Search,"J1,J3",3,Hopper,METASEARCH,Predictive pricing app with 95% fare prediction accuracy and Price Freeze feature,"Best for timing purchases; 95% prediction accuracy claimed; strong mobile-first UX",Going.com 2026; Aviation A2Z 2025; Mooloo 2025
C-FLIGHT-SEARCH,Flight Search,"J1,J3",4,KAYAK,METASEARCH,Pioneer metasearch engine with travel bundles; price alerts; and explore feature,"Original travel metasearch; comprehensive filtering; strong for deal tracking and bundles",Going.com 2026; Upgraded Points 2025; Nuroum 2025
C-FLIGHT-SEARCH,Flight Search,"J1,J3",5,Momondo,METASEARCH,Budget-focused metasearch scanning smaller OTAs for transparency in pricing,"Often finds lowest fares from smaller OTAs; praised for price transparency",Going.com 2026; OnShoreKare 2025
C-HOTEL-SEARCH,Hotel Search,"J1,J3",1,Booking.com,OTA,Largest accommodation platform with 28M+ listings and strong filtering/UX,"Market leader; deepest inventory globally; 4.4/5 App Store; best UX per Thematic analysis",Frommers 2026; SiteMinder 2025; HeyExplorer 2026; Thematic analysis
C-HOTEL-SEARCH,Hotel Search,"J1,J3",2,Expedia,OTA,Full-service OTA with bundling power; OneKey rewards; and 145M+ app downloads,"Best for bundles (flight+hotel); 145M downloads; strong loyalty program",Frommers 2026; RevFine 2025; SiteMinder 2025
C-HOTEL-SEARCH,Hotel Search,"J1,J3",3,Hotels.com,OTA,Expedia Group brand with collect-10-get-1-free loyalty model driving 22% repeat bookings,"Strong repeat-booking incentive; Secret Prices feature; part of Expedia ecosystem",RevFine 2025; SmarterTravel 2026
C-HOTEL-SEARCH,Hotel Search,"J1,J3",4,Airbnb,OTA,Alternative accommodations marketplace with Experiences; strong for unique/longer stays,"Category creator for alternative stays; Experiences add activity booking; strong brand",SiteMinder 2025; Dream Trip 2026; AppMakers 2025
C-HOTEL-SEARCH,Hotel Search,"J1,J3",5,Agoda,OTA,Booking Holdings brand with strongest Asia-Pacific coverage and competitive pricing,"3-5x higher conversion for Western properties reaching Asian markets; strong APAC deals",RevFine 2025; SmarterTravel 2026; Shout Hotels 2025
C-ACTIVITY-SEARCH,Activity Search,"J1,J2,J6",1,Viator,OTA,Largest tours and activities marketplace (owned by TripAdvisor/Liberty TripAdvisor),"Market leader for tours/activities; deepest inventory; integrated with TripAdvisor reviews",TripAdvisor ecosystem; multiple roundups 2025
C-ACTIVITY-SEARCH,Activity Search,"J1,J2,J6",2,GetYourGuide,OTA,European-origin tours and activities platform with strong curation and quality standards,"Strong European coverage; quality-focused curation; growing global presence",Multiple travel blog roundups 2025
C-ACTIVITY-SEARCH,Activity Search,"J1,J2,J6",3,Airbnb Experiences,OTA,Locally-hosted activities from cooking classes to photography walks integrated with Airbnb stays,"Unique local-host model; integrated with accommodation booking; authentic experiences",Dream Trip 2026; SiteMinder 2025
C-PRICE-COMPARE,Price Comparison,"J1,J3",1,Google Flights/Hotels/Travel,SUPER_APP,Unified metasearch across flights; hotels; and packages with price tracking,"Default starting point for 70%+ of travelers; price tracking; Explore feature",Going.com 2026; SmarterTravel 2026
C-PRICE-COMPARE,Price Comparison,"J1,J3",2,Trivago,METASEARCH,Hotel-focused price comparison scanning hundreds of booking sites,"Best location filter tested by Frommers; finds most hotels across most cities",Frommers 2026; SmarterTravel 2026
C-PRICE-COMPARE,Price Comparison,"J1,J3",3,KAYAK,METASEARCH,Cross-category metasearch with flexible date tools and price forecasting,"Comprehensive cross-category comparison; price forecast feature; deal tracking",Going.com 2026; Upgraded Points 2025
C-METASEARCH,Metasearch Aggregation,"J1,J3",1,Google Flights,METASEARCH,Fastest flight metasearch with 300+ airline partners and price calendar,"Best speed; date flexibility tools; and price intelligence labels",Going.com 2026; multiple expert rankings
C-METASEARCH,Metasearch Aggregation,"J1,J3",2,Skyscanner,METASEARCH,Broadest flight metasearch with 1200+ sources including budget carriers,"Widest source coverage; Everywhere search; best for international/budget",Going.com 2026; Moonsand comparison
C-METASEARCH,Metasearch Aggregation,"J1,J3",3,Trivago,METASEARCH,Hotel-focused metasearch owned by Expedia Group,"Most hotels found across tested cities per Frommers; strong filtering",Frommers 2026
C-BOOKING-TXN,Booking Transaction,J3,1,Booking.com,OTA,Dominant global OTA with 28M+ listings and transparent pricing,"Market leader; transparent pricing; best mobile UX per app store analysis",Frommers 2026; HeyExplorer 2026; Thematic analysis
C-BOOKING-TXN,Booking Transaction,J3,2,Expedia,OTA,Full-service OTA with cross-category booking and bundle savings,"Best bundles; OneKey rewards; 75+ country reach; strong cancellation policies",Frommers 2026; Hostaway 2025
C-BOOKING-TXN,Booking Transaction,J3,3,Airbnb,OTA,Alternative accommodation + Experiences booking with verified reviews,"Category leader in alternative stays; 4.8+ rating filter standard; Experiences expansion",SiteMinder 2025; Dream Trip 2026
C-BOOKING-TXN,Booking Transaction,J3,4,Trip.com,OTA,Asia-origin full-service OTA rivaling Expedia with strong APAC coverage,"Head-to-head with Expedia on features; strongest in Southeast Asia/Oceania",HeyExplorer 2026; SiteMinder 2025
C-TICKETING,Ticketing,"J3,J6",1,Eventbrite,EVENT_PLATFORM,Largest event ticketing platform with 90M+ attendees and 800K+ creators,"Market leader; strongest event discovery; used by 800K+ creators globally",Eventbrite 2024; EventX 2025; multiple roundups
C-TICKETING,Ticketing,"J3,J6",2,Dice,EVENT_PLATFORM,Music and nightlife ticketing with anti-scalping and fan-first policies,"Strong music/nightlife niche; no-scalping policy; growing urban presence",Multiple event industry roundups
C-TICKETING,Ticketing,"J3,J6",3,Meetup,EVENT_PLATFORM,Community event platform connecting local groups around shared interests,"Unique community-first model; strong for discovering local events while traveling",vFairs 2025; BetterWorld 2025
C-INSURANCE,Travel Insurance,"J3,J4",1,World Nomads,FINTECH,Travel insurance designed for adventurous travelers with activity coverage,"Most recommended by travel bloggers; covers adventure activities; buy-while-traveling option",Multiple travel blog roundups 2025
C-INSURANCE,Travel Insurance,"J3,J4",2,Allianz Travel Insurance,FINTECH,Major insurer with comprehensive travel coverage and strong claims processing,"Established brand; comprehensive coverage; strong claims reputation",Industry rankings 2025
C-INSURANCE,Travel Insurance,"J3,J4",3,SafetyWing,FINTECH,Subscription-based travel medical insurance popular with digital nomads,"Innovative subscription model; designed for long-term travelers/nomads",Digital nomad community recommendations 2025
C-ITINERARY-MGMT,Itinerary Management,"J2,J4,J5,J6",1,TripIt,ITINERARY_MANAGER,Industry-leading email-parsing itinerary organizer with real-time flight alerts,"Best email parsing; fastest flight alerts; offline access; 15+ year track record",A Purple Life 2025; Explore review; Business Traveller 2025
C-ITINERARY-MGMT,Itinerary Management,"J2,J4,J5,J6",2,Wanderlog,ITINERARY_MANAGER,Visual map-based trip planner with AI; collaboration; and budget tracking,"4.9 App Store / 4.7 Google Play; best design/UX; strongest collaboration features",Explore review; Rick Steves Forum 2025; BluePlanit review
C-ITINERARY-MGMT,Itinerary Management,"J2,J4,J5,J6",3,Google Travel,SUPER_APP,Free trip planning integrated with Gmail; Google Maps; and Google Flights,"Free; auto-imports from Gmail; integrated with Google ecosystem; solid baseline",Dream Trip 2026; TriPandoo 2026
C-ITINERARY-MGMT,Itinerary Management,"J2,J4,J5,J6",4,Sygic Travel,ITINERARY_MANAGER,Offline maps and trip planner with curated points of interest,"Strong offline maps; curated POI database; good for self-guided exploration",TriPandoo 2026
C-EMAIL-PARSING,Email / Confirmation Parsing,J4,1,TripIt,ITINERARY_MANAGER,Industry-best email parsing: forward confirmations to plans@tripit.com for auto-itinerary,"Gold standard for email parsing; handles flights/hotels/cars/restaurants automatically",A Purple Life 2025; Wanderlog comparison; TravelPirates 2025
C-EMAIL-PARSING,Email / Confirmation Parsing,J4,2,Wanderlog,ITINERARY_MANAGER,Gmail integration that auto-scans for travel confirmations (Pro feature),"Auto-scans Gmail; less manual than TripIt forwarding; Pro-only feature",Wanderlog blog 2024; BluePlanit review
C-EMAIL-PARSING,Email / Confirmation Parsing,J4,3,Flighty,DIRECT_SUPPLIER,Premium flight tracking app with deep airline data and live ATC integration,"Fastest delay alerts; deeper flight data than airline apps; Apple ecosystem native",Aviation A2Z 2025; TravelPirates 2025; Dream Trip 2026
C-CALENDAR-SYNC,Calendar Sync,"J2,J4",1,TripIt,ITINERARY_MANAGER,Syncs itinerary to Google/Outlook/Apple calendars via .ics export,"Seamless calendar integration; industry standard .ics export",A Purple Life 2025; Folio.id 2025
C-CALENDAR-SYNC,Calendar Sync,"J2,J4",2,Wanderlog,ITINERARY_MANAGER,Google Maps export and calendar integration for trip planning,"Google Maps export (slightly buggy per reviews); calendar integration",Wanderlog blog 2024; Rick Steves Forum 2025
C-CALENDAR-SYNC,Calendar Sync,"J2,J4",3,Flighty,DIRECT_SUPPLIER,Deep Apple Calendar and ecosystem integration for flight tracking,"Strong Apple ecosystem integration; 2025 calendar tools praised",Aviation A2Z 2025
C-MAPPING-NAV,Mapping & Navigation,"J5,J6",1,Google Maps,MAPPING_SERVICE,Dominant global mapping with real-time transit; walking; driving navigation,"De facto standard; 70%+ traveler usage; best transit/walking data globally",Dream Trip 2026; OHAYU 2026; virtually every travel roundup
C-MAPPING-NAV,Mapping & Navigation,"J5,J6",2,Apple Maps,MAPPING_SERVICE,iOS-native mapping with growing transit coverage and privacy focus,"Strong iOS integration; improving rapidly; privacy-focused alternative",Multiple expert roundups 2025
C-MAPPING-NAV,Mapping & Navigation,"J5,J6",3,Maps.me / Organic Maps,MAPPING_SERVICE,Offline-first maps using OpenStreetMap data; ideal for areas without connectivity,"Best offline experience; free; uses OpenStreetMap; essential for remote travel",Capture the Atlas 2025; multiple backpacker roundups
C-LOCAL-DISCOVERY,Local Discovery (nearby now),J6,1,Google Maps,MAPPING_SERVICE,Real-time local business search; reviews; hours; and live busyness data,"Default local discovery tool; live data; integrated reviews; busyness indicators",Virtually every travel app roundup
C-LOCAL-DISCOVERY,Local Discovery (nearby now),J6,2,Yelp,REVIEW_PLATFORM,Restaurant and local business discovery dominant in North American cities,"Category leader for dining discovery; strong photos/reviews; reservations integration",Semrush 2026; Latterly 2025
C-LOCAL-DISCOVERY,Local Discovery (nearby now),J6,3,Foursquare / Swarm,SOCIAL_PLATFORM,Location intelligence platform with curated local recommendations,"Pioneer in location-based discovery; strong curated recommendations; used by many apps' backends",Alternative.me; Foursquare ecosystem
C-LOCAL-DISCOVERY,Local Discovery (nearby now),J6,4,TripAdvisor,REVIEW_PLATFORM,Nearby attractions/restaurants with ranking and reviews,"Strong nearby discovery; 1B+ reviews; but increasingly Viator-booking-focused",Latterly 2025; Rick Steves Forum frustrations
C-EVENT-DISCOVERY,Event Discovery (upcoming),"J2,J6",1,Eventbrite,EVENT_PLATFORM,Largest event discovery and ticketing platform with strong search/filtering,"Market leader for event discovery; strongest search engine; 800K+ creators",Eventbrite 2024; EventX 2025
C-EVENT-DISCOVERY,Event Discovery (upcoming),"J2,J6",2,Facebook Events,SOCIAL_PLATFORM,Massive event discovery network leveraging social graph for local events,"Largest event network via social graph; strong for community/local events",Trend Watchers 2024
C-EVENT-DISCOVERY,Event Discovery (upcoming),"J2,J6",3,Time Out,CONTENT_PLATFORM,Expert-curated city event guides with editorial quality control,"Best editorial curation; trusted for cultural events; strong urban coverage",Trend Watchers 2024
C-EVENT-DISCOVERY,Event Discovery (upcoming),"J2,J6",4,AllEvents.in,EVENT_PLATFORM,Global event aggregator with broad category coverage,"Widest event aggregation; strong international coverage; robust filtering",Trend Watchers 2024; CheckoutPage 2025
C-TRANSIT-INFO,Transit / Transport Info,"J5,J6",1,Google Maps Transit,MAPPING_SERVICE,Real-time public transit routing integrated with walking/driving directions,"Best transit coverage globally; real-time arrival data; integrated multimodal",Virtually every travel roundup
C-TRANSIT-INFO,Transit / Transport Info,"J5,J6",2,Uber,TRANSIT_SERVICE,Global rideshare with upfront pricing; safety features; and 10K+ city coverage,"10K+ cities; upfront pricing; rated safety features; essential for airport transfers",Aviation A2Z 2025; Suitcase Escapes 2026
C-TRANSIT-INFO,Transit / Transport Info,"J5,J6",3,Rome2Rio,TRANSIT_SERVICE,Multi-modal transport search showing all options (flight; train; bus; ferry; drive) between any two points,"Unique multi-modal comparison; shows all transport options between any two points",TravelingLifestyle 2026
C-TRANSIT-INFO,Transit / Transport Info,"J5,J6",4,Citymapper,TRANSIT_SERVICE,Urban transit app with real-time data for major cities worldwide,"Best UX for urban transit; real-time data; strong in supported cities",Multiple urban travel roundups
C-EXPENSE-MGMT,Expense Management,J7,1,Splitwise,FINTECH,Group expense splitting app used by travelers to manage shared costs,"Gold standard for group cost splitting; free; cross-platform; widely adopted",National Traveller 2025; Bob Hotels 2025
C-EXPENSE-MGMT,Expense Management,J7,2,TravelSpend,FINTECH,Travel-specific budget tracker with multi-currency; receipt photos; and offline mode,"4.8 App Store; best travel-specific features; offline + multi-currency + receipt photos",National Traveller 2025; Bob Hotels 2025
C-EXPENSE-MGMT,Expense Management,J7,3,Revolut,FINTECH,Multi-currency fintech with real-time expense categorization and travel-friendly cards,"Real-time categorization; 150+ currencies; built-in budgeting; used by millions of travelers",Drift Travel 2026; FangWallet 2025; Mobile Marketing Reads 2025
C-EXPENSE-MGMT,Expense Management,J7,4,Trail Wallet,FINTECH,Simple iOS-only travel budget app with offline tracking and daily budget alerts,"Simplest UX; best for solo travelers; offline-first; one-time $2.99 purchase",National Traveller 2025; The Traveler 2025; Matador Network
C-EXPENSE-MGMT,Expense Management,J7,5,Wise,FINTECH,Mid-market rate currency exchange with transparent fees and multi-currency accounts,"Best exchange rates (mid-market); 40+ currencies; transparent fees; trusted for large transfers",FangWallet 2025; Drift Travel 2026; Dream Trip 2026
C-LOYALTY-MGMT,Loyalty Program Management,"J3,J7",1,AwardWallet,LOYALTY_PLATFORM,Tracks 700+ loyalty programs including airlines; hotels; and credit cards in one dashboard,"Most comprehensive loyalty tracker; 700+ programs; expiration alerts",Points/miles community consensus
C-LOYALTY-MGMT,Loyalty Program Management,"J3,J7",2,The Points Guy (TPG),CONTENT_PLATFORM,Points and miles editorial content with card valuations and redemption guides,"Most influential points/miles content brand; card valuations widely referenced",Points/miles community consensus
C-LOYALTY-MGMT,Loyalty Program Management,"J3,J7",3,Flighty,DIRECT_SUPPLIER,Flight tracking with airline loyalty integration and status tracking,"TripIt Pro competitor for flight tracking; integrates loyalty status",Aviation A2Z 2025; TravelPirates 2025
C-API-PLATFORM,API / GDS Platform,"J1,J2,J3,J4,J5",1,Amadeus,API_PLATFORM,Largest GDS with 32% global market share; 490+ airlines; 770K+ hotels; REST/SOAP/NDC APIs,"Market leader; 190+ countries; strongest NDC adoption (19 airline partners); AI-driven dynamic pricing",AltexSoft 2025; Guru Technolabs 2025; Future Market Insights 2025
C-API-PLATFORM,API / GDS Platform,"J1,J2,J3,J4,J5",2,Sabre,API_PLATFORM,30% global air market share GDS; REST/JSON APIs; strong North America presence; SabreSonic PSS,"#2 GDS globally; 400+ airlines; 750K hotels; best NDC shop capabilities (10); Red 360 agent platform",AltexSoft 2025; OneClickIT 2025; PHPTravels 2025
C-API-PLATFORM,API / GDS Platform,"J1,J2,J3,J4,J5",3,Travelport,API_PLATFORM,Third major GDS (22% share) combining Galileo/Worldspan/Apollo; first GDS with NDC; Universal API,"Most cost-effective GDS; first to offer NDC channels; JSON Air APIs for GDS+NDC hybrid model",AltexSoft 2025; OneClickIT 2025; Traveltekpro 2025
C-API-PLATFORM,API / GDS Platform,"J1,J2,J3,J4,J5",4,Expedia Rapid API,API_PLATFORM,OTA-based API focused on hotel aggregation and bundled packages; lighter integration for startups,"Strongest hotel/package API for regional OTAs and startups; faster integration than GDS",Traveltekpro 2025
C-API-PLATFORM,API / GDS Platform,"J1,J2,J3,J4,J5",5,Kiwi.com (Tequila API),API_PLATFORM,Virtual interlining API combining flights from different carriers into single itineraries,"Pioneer in virtual interlining; AI-driven fare prediction; strong LCC coverage; 25% regional market share",Future Market Insights 2025; Nuroum 2025
C-AI-AGENT,AI Travel Agent,"J0,J1,J2,J3,J4,J5,J6,J7",1,Google AI Mode (Travel),AI_AGENT,Agentic booking tools for flights/hotels within Google AI Mode; partnering with Booking.com and Marriott,"Deepest integration (Maps/Gmail/Calendar); agentic booking in development; largest user base",Skift Nov 2025; iMean.ai 2025
C-AI-AGENT,AI Travel Agent,"J0,J1,J2,J3,J4,J5,J6,J7",2,Expedia Romie,AI_AGENT,AI travel assistant joining group chats (iMessage/WhatsApp) to plan/book/troubleshoot trips end-to-end,"First OTA AI assistant in group chats; real-time itinerary updates; progressive personalization; OpenAI-powered",TechCrunch 2024; Hotel Dive 2024; Thunderbit 2025
C-AI-AGENT,AI Travel Agent,"J0,J1,J2,J3,J4,J5,J6,J7",3,Booking.com AI (Smart Messenger / Trip Planner),AI_AGENT,Agentic AI with Smart Messenger auto-reply; AI Trip Planner; AI Rental Helper; ChatGPT integration,"First app in ChatGPT; Smart Messenger autonomously handles guest comms; AI voice support live in 10 markets",Booking.com Oct 2025; Skift 2025; Coaxsoft 2025
C-AI-AGENT,AI Travel Agent,"J0,J1,J2,J3,J4,J5,J6,J7",4,Trip.com TripGenie,AI_AGENT,AI agent suggesting full trips with flights/hotels/activities; price prediction; multi-language; Asia-strong,"Strongest AI travel agent in Asia; predicts pricing fluctuations; considers past preferences and local insights",Coaxsoft 2025; Thunderbit 2025
C-AI-AGENT,AI Travel Agent,"J0,J1,J2,J3,J4,J5,J6,J7",5,Navan AI Agent,AI_AGENT,Corporate travel AI automating rebooking; expense reports; policy enforcement; satisfaction on par with humans,"Leading corporate travel AI; instant rebooking; expense categorization; policy compliance automation",Latenode 2025; Thunderbit 2025; Coaxsoft 2025
C-AI-AGENT,AI Travel Agent,"J0,J1,J2,J3,J4,J5,J6,J7",6,Mindtrip,AI_AGENT,Startup generative AI itinerary planner creating complex trip plans from text; integrated booking via partners,"Most promising pure-play AI travel startup; text-to-itinerary; connected booking via Skyscanner/Booking.com/GetYourGuide",Coaxsoft 2025; Mindtrip.ai
C-AI-AGENT,AI Travel Agent,"J0,J1,J2,J3,J4,J5,J6,J7",7,OpenClaw (via travel skills),AI_AGENT,Open-source autonomous AI agent framework; runs locally; can manage calendars/booking/web browsing via LLM skills,"195K GitHub stars; originated as travel assistant in Morocco; can book flights/manage calendars; major security concerns",CNBC Feb 2026; IBM Think 2026; Wikipedia; Euronews 2026
C-AI-AGENT,AI Travel Agent,"J0,J1,J2,J3,J4,J5,J6,J7",8,Layla / TripPlanner AI,AI_AGENT,AI trip planner with real-time price comparison for flights/hotels; one-click itinerary adjustment,"Compares real-time prices via Skyscanner/Booking.com/GetYourGuide; instant itinerary swap/adjust",TripPlanner.ai 2025
C-AI-AGENT,AI Travel Agent,"J0,J1,J2,J3,J4,J5,J6,J7",9,GuideGeek,AI_AGENT,AI travel assistant on WhatsApp/Instagram providing personalized real-time destination recommendations,"Chat-native (WhatsApp/IG); hyperlocal recs; no app install needed; AI-powered by Matador Network",Latenode 2025; Schengen Travel Info 2025
